<?xml version="1.0"?>
<UiLayout xmlns="http://mmo-dev.net/ui" xmlns:xsi="http://www.w3.org/2001/XMLSchema-instance" xsi:schemaLocation="http://mmo-dev.net/ui UI.xsd">
	<Script file="CharCreate.lua" />

	<!-- This is the character selection screen frame. It covers the whole screen. -->
	<Frame name="CharCreate" parent="GlueParent" setAllPoints="true" renderer="DefaultRenderer">
		<Property name="Visible" value="false" />

		<!-- For now, only a placeholder image is rendered in the background -->
		<Visual>
			<ImagerySection name="Background">
				<ImageComponent texture="Interface/GlueUI/BackgroundPH.htex" tiling="NONE" />
			</ImagerySection>
			<StateImagery name="Enabled">
				<Layer>
					<Section section="Background" />
				</Layer>
			</StateImagery>
		</Visual>
		
		<Frame name="CharCreateModel" type="Model" setAllPoints="true" renderer="ModelRenderer">
			<Property name="Visible" value="false" />
			<Property name="ModelFile" value="Models/Cube/Cube.hmsh" />
		</Frame>
		
		<Frame renderer="DefaultRenderer">
			<Area>
				<Anchor point="LEFT"/>
				<Anchor point="RIGHT"/>
				<Anchor point="BOTTOM"/>
				<Size>
					<AbsDimension y="200" />
				</Size>
			</Area>
			<Visual>
				<ImagerySection name="Background">
					<ImageComponent texture="Interface/GlueUI/GradientBlack.htex" tiling="HORZ" />
				</ImagerySection>

				<StateImagery name="Enabled">
					<Layer>
						<Section section="Background" />
					</Layer>
				</StateImagery>
			</Visual>

			<Frame name="CharCreateSubmitButton" inherits="GlueButtonPrimary">
				<Property name="Text" value="CREATE_CHARACTER" />
				<Area>
					<Anchor point="BOTTOM" offset="-24" />
					<Anchor point="H_CENTER" />
				</Area>
			</Frame>
			
			<Frame name="NewCharacterNameBox" inherits="GlueTextField">
				<Area>
					<Anchor point="BOTTOM" relativePoint="TOP" relativeTo="CharCreateSubmitButton" offset="-8" />
					<Anchor point="H_CENTER" />
				</Area>
			</Frame>

			<Frame name="CancelCharCreationButton" inherits="GlueButton">
				<Property name="Text" value="CANCEL" />
				<Area>
					<Anchor point="RIGHT" offset="-24" />
					<Anchor point="BOTTOM" offset="-24" />
				</Area>
			</Frame>
		</Frame>
	</Frame>
</UiLayout>
