<?xml version="1.0" ?>
<UiLayout xmlns="http://www.w3schools.com/Ui" xmlns:xsi="http://www.w3.org/2001/XMLSchema-instance" xsi:schemaLocation="http://www.w3schools.com/Ui.xsd file:///F:/mmo/data/client/Interface/Ui.xsd">
	<Script file="SpellBook.lua" />

	<Frame name="SpellBookButtonTemplate" type="Button" renderer="ButtonRenderer">
		<Property name="Icon" />

		<Visual>
			<ImagerySection name="Image">
				<ImageComponent>
					<Area>
						<Inset all="16" />
					</Area>
					<PropertyValue property="Icon" />
				</ImageComponent>
			</ImagerySection>
			<ImagerySection name="NormalFrame">
				<BorderComponent texture="Interface/BW_ButtonSmall_Up.htex" borderSize="30" />
			</ImagerySection>
			<ImagerySection name="HoveredFrame">
				<BorderComponent texture="Interface/BW_ButtonSmall_Over.htex" borderSize="30" />
			</ImagerySection>
			<ImagerySection name="PushedFrame">
				<BorderComponent texture="Interface/BW_ButtonSmall_Down.htex" borderSize="30" />
			</ImagerySection>
			<ImagerySection name="DisabledFrame">
				<BorderComponent texture="Interface/BW_ButtonSmall_Up.htex" borderSize="30" />
			</ImagerySection>
			<StateImagery name="Normal">
				<Layer>
					<Section section="NormalFrame" />
					<Section section="Image" />
				</Layer>
			</StateImagery>
			<StateImagery name="Hovered">
				<Layer>
					<Section section="HoveredFrame" />
					<Section section="Image" />
				</Layer>
			</StateImagery>
			<StateImagery name="Pushed">
				<Layer>
					<Section section="PushedFrame" />
					<Section section="Image" />
				</Layer>
			</StateImagery>
			<StateImagery name="Disabled">
				<Layer>
					<Section section="DisabledFrame" />
					<Section section="Image" />
				</Layer>
			</StateImagery>
		</Visual>

        <Frame name="NameLabel" inherits="TextSmall">
            <Property name="Text" value="Spell" />
                
            <Area>
                <Anchor point="TOP" />
                <Anchor point="LEFT" offset="128" />
                <Size><AbsDimension x="128" y="32" /></Size>
            </Area>
        </Frame>

        <Frame name="SubLabel" inherits="TextSmall">
            <Property name="Text" value="Rank 1" />
            
            <Area>
                <Anchor point="TOP" relativeTo="NameLabel" relativePoint="BOTTOM" />
                <Anchor point="LEFT" offset="128" />
                <Size><AbsDimension x="128" y="32" /></Size>
            </Area>
        </Frame>

		<Area>
			<Size>
				<AbsDimension x="128" y="128" />
			</Size>
		</Area>
	</Frame>

    <Frame name="SpellBook" renderer="DefaultRenderer" parent="GameParent">
		<Visual>
			<ImagerySection name="Background">
				<BorderComponent texture="Interface/GameUI/fg4_borders_01_03.htex" borderSize="250" />
			</ImagerySection>
			<StateImagery name="Enabled">
				<Layer>
					<Section section="Background" />
				</Layer>
			</StateImagery>
		</Visual>

        <Area>
			<Size><AbsDimension x="960" y="1280" /></Size>
            <Anchor point="LEFT" offset="32" />
            <Anchor point="TOP" offset="256" />
        </Area>

		<Frame name="SpellBookTitleBar" inherits="TitleBar">
			<Property name="Text" value="SPELLBOOK" />

			<Area>
				<Anchor point="TOP" offset="62" />
				<Anchor point="LEFT" offset="48" />
				<Anchor point="RIGHT" offset="-48" />
			</Area>
		</Frame>

        <Frame inherits="SpellBookButtonTemplate" name="SpellBookButton01">
            <Property name="Icon" value="Interface/Icons/Spells/S_Attack.htex" />
            <Area>
                <Anchor point="TOP" relativeTo="SpellBookTitleBar" relativePoint="BOTTOM" offset="16" />
                <Anchor point="LEFT" offset="64" />
            </Area>
        </Frame>

        <Frame inherits="SpellBookButtonTemplate" name="SpellBookButton02">
            <Property name="Icon" value="Interface/Icons/Spells/S_Fireball.htex" />
            <Area>
                <Anchor point="TOP" relativeTo="SpellBookButton01" />
                <Anchor point="LEFT" relativePoint="H_CENTER" offset="16" />
            </Area>
        </Frame>

        <Frame inherits="SpellBookButtonTemplate" name="SpellBookButton03">
            <Property name="Icon" value="Interface/Icons/Spells/S_FrostBolt.htex" />
            <Area>
                <Anchor point="TOP" relativePoint="BOTTOM" relativeTo="SpellBookButton01" offset="16" />
                <Anchor point="LEFT" relativeTo="SpellBookButton01" />
            </Area>
        </Frame>

        <Frame inherits="SpellBookButtonTemplate" name="SpellBookButton04">
            <Area>
                <Anchor point="TOP" relativeTo="SpellBookButton03" />
                <Anchor point="LEFT" relativeTo="SpellBookButton02" />
            </Area>
        </Frame>

        <Scripts>
            <OnLoad>
                return function(this)
                    SpellBook_OnLoad()
                end
            </OnLoad>
        </Scripts>
    </Frame>
</UiLayout>