<?xml version="1.0" ?>
<UiLayout xmlns="http://www.w3schools.com/Ui" xmlns:xsi="http://www.w3.org/2001/XMLSchema-instance" xsi:schemaLocation="http://www.w3schools.com/Ui.xsd file:///F:/mmo/data/client/Interface/Ui.xsd">
	<Script file="TargetFrame.lua" />

    <Frame name="TargetFrame" parent="GameParent">
		<Area>
			<Size>
				<AbsDimension x="440" y="128" />
				<Anchor point="LEFT" relativePoint="H_CENTER" offset="32" />
				<Anchor point="BOTTOM" relativeTo="GameMenuBar" relativePoint="TOP" offset="-384" />
			</Size>
		</Area>

		<Frame name="TargetName" inherits="TextSmall">
			<Property name="Text" value="Target Name" />
			<Area>
				<Anchor point="LEFT" />
				<Anchor point="RIGHT" />
				<Anchor point="TOP" />
				<Size><AbsDimension y="42" /></Size>
			</Area>
		</Frame>

		<Frame name="TargetHealthBar" type="ProgressBar">
			<Property name="Progress" value="0.12783" />
			<Property name="Text" value="0%" />
			<Property name="Font" value="DefaultSmall" />

			<Area>
				<Anchor point="LEFT" />
				<Anchor point="RIGHT" />
				<Anchor point="TOP" relativeTo="TargetName" relativePoint="BOTTOM" />
				<Size><AbsDimension y="32" /></Size>
			</Area>

			<Visual>
				<ImagerySection name="Caption">
					<TextComponent color="FFFFFFFF" horzAlign="CENTER" vertAlign="CENTER" />
				</ImagerySection>
				<ImagerySection name="Background">
					<BorderComponent texture="Interface/fg4_borders_01_33.htex" borderSize="5" />
				</ImagerySection>
				<ImagerySection name="Border">
					<BorderComponent texture="Interface/GameUI/fg4_borders_insetBlack.htex" borderSize="24" />
				</ImagerySection>
				<ImagerySection name="Progress">
					<ImageComponent texture="Interface/fg4_gradientWhiteV1_result.htex" tiling="HORZ" tint="FF00FF00">
						<Area><Inset all="8" /></Area>
					</ImageComponent>
				</ImagerySection>

				<StateImagery name="Enabled">
					<Layer>
						<Section section="Background" />
					</Layer>
				</StateImagery>
				<StateImagery name="Disabled">
					<Layer>
						<Section section="Background" />
					</Layer>
				</StateImagery>
				<StateImagery name="Progress">
					<Layer>
						<Section section="Progress" />
					</Layer>
				</StateImagery>
				<StateImagery name="Overlay">
					<Layer>
						<Section section="Border" />
						<Section section="Caption" />
					</Layer>
				</StateImagery>
			</Visual>
		</Frame>

		<Frame name="TargetManaBar" type="ProgressBar">
			<Property name="Progress" value="0.12783" />
			<Property name="Font" value="DefaultSmall" />

			<Area>
				<Anchor point="LEFT" />
				<Anchor point="RIGHT" />
				<Anchor point="TOP" relativePoint="BOTTOM" relativeTo="TargetHealthBar" />
				<Size><AbsDimension y="32" /></Size>
			</Area>

			<Visual>
				<ImagerySection name="Caption">
					<TextComponent color="FFFFFFFF" horzAlign="CENTER" vertAlign="CENTER" />
				</ImagerySection>
				<ImagerySection name="Background">
					<BorderComponent texture="Interface/fg4_borders_01_33.htex" borderSize="5" />
				</ImagerySection>
				<ImagerySection name="Border">
					<BorderComponent texture="Interface/GameUI/fg4_borders_insetBlack.htex" borderSize="24" />
				</ImagerySection>
				<ImagerySection name="Progress">
					<ImageComponent texture="Interface/fg4_gradientWhiteV1_result.htex" tiling="HORZ" tint="FF0000FF">
						<Area><Inset all="8" /></Area>
					</ImageComponent>
				</ImagerySection>

				<StateImagery name="Enabled">
					<Layer>
						<Section section="Background" />
					</Layer>
				</StateImagery>
				<StateImagery name="Disabled">
					<Layer>
						<Section section="Background" />
					</Layer>
				</StateImagery>
				<StateImagery name="Progress">
					<Layer>
						<Section section="Progress" />
					</Layer>
				</StateImagery>
				<StateImagery name="Overlay">
					<Layer>
						<Section section="Border" />
						<Section section="Caption" />
					</Layer>
				</StateImagery>
			</Visual>
		</Frame>

        <Frame name="TargetAuraButton1" inherits="AuraBarButtonTemplate" id="1">
            <Area>
                <Anchor point="LEFT" offset="0" />
                <Anchor point="TOP" relativePoint="BOTTOM" offset="0" />
				<Size><AbsDimension x="96" y="96" /></Size>
            </Area>
			<Scripts>
				<OnLoad>
					return function(this)
					end
				</OnLoad>
				<OnUpdate>
					return function(this, elapsed)
					end
				</OnUpdate>
			</Scripts>
        </Frame>
        
        <Frame name="TargetAuraButton2" inherits="AuraBarButtonTemplate" id="2">
            <Area>
                <Anchor point="LEFT" relativeTo="TargetAuraButton1" relativePoint="RIGHT" offset="0" />
                <Anchor point="TOP" relativeTo="TargetAuraButton1" />
				<Size><AbsDimension x="96" y="96" /></Size>
            </Area>
			<Scripts>
				<OnLoad>
					return function(this)
					end
				</OnLoad>
				<OnUpdate>
					return function(this, elapsed)
					end
				</OnUpdate>
			</Scripts>
        </Frame>
        
        <Frame name="TargetAuraButton3" inherits="AuraBarButtonTemplate" id="3">
            <Area>
                <Anchor point="LEFT" relativeTo="TargetAuraButton2" relativePoint="RIGHT" offset="0" />
                <Anchor point="TOP" relativeTo="TargetAuraButton1" />
				<Size><AbsDimension x="96" y="96" /></Size>
            </Area>
			<Scripts>
				<OnLoad>
					return function(this)
					end
				</OnLoad>
				<OnUpdate>
					return function(this, elapsed)
					end
				</OnUpdate>
			</Scripts>
        </Frame>
        
        <Frame name="TargetAuraButton4" inherits="AuraBarButtonTemplate" id="4">
            <Area>
                <Anchor point="LEFT" relativeTo="TargetAuraButton3" relativePoint="RIGHT" offset="0" />
                <Anchor point="TOP" relativeTo="TargetAuraButton1" />
				<Size><AbsDimension x="96" y="96" /></Size>
            </Area>
			<Scripts>
				<OnLoad>
					return function(this)
					end
				</OnLoad>
				<OnUpdate>
					return function(this, elapsed)
					end
				</OnUpdate>
			</Scripts>
        </Frame>
        
        <Frame name="TargetAuraButton5" inherits="AuraBarButtonTemplate" id="5">
            <Area>
                <Anchor point="LEFT" relativeTo="TargetAuraButton4" relativePoint="RIGHT" offset="0" />
                <Anchor point="TOP" relativeTo="TargetAuraButton1" />
				<Size><AbsDimension x="96" y="96" /></Size>
            </Area>
			<Scripts>
				<OnLoad>
					return function(this)
					end
				</OnLoad>
				<OnUpdate>
					return function(this, elapsed)
					end
				</OnUpdate>
			</Scripts>
        </Frame>

		<Scripts>
			<OnLoad>
				return function(this)
					TargetFrame_OnLoad();
				end
			</OnLoad>
		</Scripts>
    </Frame>
</UiLayout>