<?xml version="1.0" ?>
<UiLayout xmlns="http://www.w3schools.com/Ui" xmlns:xsi="http://www.w3.org/2001/XMLSchema-instance" xsi:schemaLocation="file:\\F:\mmo\data\client\Interface\Ui.xsd">
	<Script file="PlayerFrame.lua" />

    <Frame name="PlayerFrame" parent="GameParent" renderer="DefaultRenderer">
        <Area>
            <Anchor point="LEFT" offset="32" />
            <Anchor point="TOP" offset="32" />
            <Size><AbsDimension x="512" y="164" /></Size>
        </Area>

		<Visual>
			<ImagerySection name="Background">
                <BorderComponent texture="Interface/GameUI/fg4_gradientBlackCircle2.htex" borderSize="31" tint="51FFFFFF" />
            </ImagerySection>
            <StateImagery name="Enabled">
                <Layer>
                    <Section section="Background" />
                </Layer>
            </StateImagery>
            <StateImagery name="Disabled">
                <Layer>
                    <Section section="Background" />
                </Layer>
            </StateImagery>
		</Visual>

		<Frame name="PlayerPortrait" renderer="DefaultRenderer">
			<Area>
				<Anchor point="TOP" offset="5" />
				<Anchor point="LEFT" offset="5" />
				<Size><AbsDimension x="128" y="128" /></Size>
			</Area>

			<Visual>
				<ImagerySection name="Background">
					<BorderComponent texture="Interface/GameUI/fg4_slotBrownRound1_result.htex" borderSize="36" tint="FFFFFFFF" />
				</ImagerySection>
				<StateImagery name="Enabled">
					<Layer>
						<Section section="Background" />
					</Layer>
				</StateImagery>
				<StateImagery name="Disabled">
					<Layer>
						<Section section="Background" />
					</Layer>
				</StateImagery>
			</Visual>

			<Frame name="PlayerPortraitLevel" renderer="DefaultRenderer">
				<Property name="Font" value="DefaultSmall" />
				<Property name="Text" value="1" />
				<Property name="TextColor" value="FFFFFFFF" />
				
				<Visual>
					<ImagerySection name="Background">
						<ImageComponent texture="Interface/GameUI/fg4_progressbar1.htex" tiling="NONE" tint="FFFF0909" />
						<TextComponent color="$TextColor" horzAlign="CENTER" vertAlign="CENTER" />
					</ImagerySection>
					<StateImagery name="Enabled">
						<Layer>
							<Section section="Background" />
						</Layer>
					</StateImagery>
					<StateImagery name="Disabled">
						<Layer>
							<Section section="Background" />
						</Layer>
					</StateImagery>
				</Visual>

				<Area>
					<Anchor point="H_CENTER" />
					<Anchor point="BOTTOM" offset="24" />
					<Size><AbsDimension x="72" y="48" /></Size>
				</Area>
			</Frame>
		</Frame>

        <Frame name="PlayerName" inherits="TextSmall">
            <Property name="Text" value="Player" />
			<Property name="Font" value="DefaultSmallOutline" />

            <Area>
                <Anchor point="LEFT" relativePoint="RIGHT" relativeTo="PlayerPortrait" offset="10" />
                <Anchor point="RIGHT" offset="-10" />
                <Anchor point="TOP" offset="10" />
                <Size><AbsDimension y="42" /></Size>
            </Area>
        </Frame>

        <Frame name="PlayerHealthBar" type="ProgressBar">
            <Property name="Progress" value="0.12783" />
			<Property name="Font" value="DefaultSmall" />

            <Area>
                <Anchor point="LEFT" relativePoint="RIGHT" relativeTo="PlayerPortrait" offset="10" />
                <Anchor point="RIGHT" offset="-10" />
                <Anchor point="TOP" relativeTo="PlayerName" relativePoint="BOTTOM" />
                <Size><AbsDimension y="70" /></Size>
            </Area>
            
			<Visual>
				<ImagerySection name="Caption">
					<TextComponent color="FFFFFFFF" horzAlign="CENTER" vertAlign="CENTER" />
				</ImagerySection>
				<ImagerySection name="Background">
					<BorderComponent texture="Interface/fg4_borders_01_33.htex" borderSize="5" />
				</ImagerySection>
				<ImagerySection name="Border">
					<BorderComponent texture="Interface/GameUI/fg4_borders_01_07_02.htex" borderSize="55" />
				</ImagerySection>
				<ImagerySection name="Progress">
					<ImageComponent texture="Interface/fg4_gradientWhiteV1_result.htex" tiling="HORZ" tint="FF00FF00">
						<Area><Inset all="8" /></Area>
					</ImageComponent>
				</ImagerySection>

				<StateImagery name="Enabled">
					<Layer>
						<Section section="Background" />
					</Layer>
				</StateImagery>
				<StateImagery name="Disabled">
					<Layer>
						<Section section="Background" />
					</Layer>
				</StateImagery>
				<StateImagery name="Progress">
					<Layer>
						<Section section="Progress" />
					</Layer>
				</StateImagery>
				<StateImagery name="Overlay">
					<Layer>
						<Section section="Border" />
						<Section section="Caption" />
					</Layer>
				</StateImagery>
			</Visual>"
        </Frame>

		<Frame name="PlayerManaBar" type="ProgressBar">
			<Property name="Progress" value="0.12783" />
			<Property name="Font" value="DefaultSmall" />

			<Area>
				<Anchor point="LEFT" relativePoint="RIGHT" relativeTo="PlayerPortrait" offset="10" />
				<Anchor point="RIGHT" offset="-10" />
				<Anchor point="TOP" relativePoint="BOTTOM" relativeTo="PlayerHealthBar" />
				<Size><AbsDimension y="40" /></Size>
			</Area>

			<Visual>
				<ImagerySection name="Caption">
					<TextComponent color="FFFFFFFF" horzAlign="CENTER" vertAlign="CENTER" />
				</ImagerySection>
				<ImagerySection name="Background">
					<BorderComponent texture="Interface/fg4_borders_01_33.htex" borderSize="5" />
				</ImagerySection>
				<ImagerySection name="Border">
					<BorderComponent texture="Interface/GameUI/fg4_borders_insetBlackSmall.htex" borderSize="11" />
				</ImagerySection>
				<ImagerySection name="Progress">
					<ImageComponent texture="Interface/fg4_gradientWhiteV1_result.htex" tiling="HORZ">
						<Area><Inset all="8" /></Area>
					</ImageComponent>
				</ImagerySection>

				<StateImagery name="Enabled">
					<Layer>
						<Section section="Background" />
					</Layer>
				</StateImagery>
				<StateImagery name="Disabled">
					<Layer>
						<Section section="Background" />
					</Layer>
				</StateImagery>
				<StateImagery name="Progress">
					<Layer>
						<Section section="Progress" />
					</Layer>
				</StateImagery>
				<StateImagery name="Overlay">
					<Layer>
						<Section section="Border" />
						<Section section="Caption" />
					</Layer>
				</StateImagery>
			</Visual>
		</Frame>

        <Frame name="PlayerLeaderIcon" inherits="IconTemplate">
            <Property name="Visible" value="false" />
            <Property name="Icon" value="Interface/Icons/fg4_iconsGold_crown_result.htex" />

            <Area>
                <Anchor point="TOP" offset="10" />
                <Anchor point="LEFT" offset="10" />
            </Area>
        </Frame>

		<Frame name="PlayerFrameClick" setAllPoints="true">
			<Scripts>
				<OnClick>
					return function(self)
						PlayerFrame_OnClick(PlayerFrame);
					end
				</OnClick>
			</Scripts>
		</Frame>

        <Scripts>
            <OnLoad>
                return function(self)
                    PlayerFrame_OnLoad(self);
                end
            </OnLoad>
        </Scripts>
    </Frame>
</UiLayout>
